{
  "devices": [
    {
      "device_id": 0,
      "core_id": [0],
      "core_type": 0,
      "device_type": 0,
      "soc_id": 676,
      "soc_model": 77,
      "dsp_arch": "v73",
      "pd_session": "unsigned",
      "cores": [
        {
          "perf_profile": "custom",
          "rpc_control_latency": 100,
          "rpc_polling_time": 9999,
          "hmx_timeout_us": 2000000,
          "custom": [
            {
              "graphState": ["init_start", "inference_start"],
              "sustainInferencePerfState": true,
              "dcvsControl": {
                "enableDcvs": false,
                "sleep_disable": true,
                "sleep_latency_us": 40,
                "powerMode": "QNN_HTP_PERF_INFRASTRUCTURE_POWERMODE_PERFORMANCE_MODE",
                "busVoltageCornerMin": "DCVS_VOLTAGE_VCORNER_MAX_VOLTAGE_CORNER",
                "busVoltageCornerTarget": "DCVS_VOLTAGE_VCORNER_MAX_VOLTAGE_CORNER",
                "busVoltageCornerMax": "DCVS_VOLTAGE_VCORNER_MAX_VOLTAGE_CORNER",
                "coreVoltageCornerMin": "DCVS_VOLTAGE_VCORNER_MAX_VOLTAGE_CORNER",
                "coreVoltageCornerTarget": "DCVS_VOLTAGE_VCORNER_MAX_VOLTAGE_CORNER",
                "coreVoltageCornerMax": "DCVS_VOLTAGE_VCORNER_MAX_VOLTAGE_CORNER"
              },
              "hmxControl": {
                "hmxPickDefault": 0,
                "hmxPerfMode": 0,
                "hmxVoltageCornerMin": "DCVS_EXP_VCORNER_MAX",
                "hmxVoltageCornerTarget": "DCVS_EXP_VCORNER_MAX",
                "hmxVoltageCornerMax": "DCVS_EXP_VCORNER_MAX"
              }
            }
          ]
        }
      ]
    }
  ],
  "memory": {
    "mem_type": "shared_buffer"
  },
  "context": [
    {
      "contextKey": "pi05",
      "weight_sharing_enabled": true,
      "group_id": 0,
      "max_spill_fill_buffer_for_group": 155713536,
      "init_acceleration": true,
      "io_memory_estimation": true,
      "file_read_memory_budget_in_mb": 256,
      "reused_io_limit_mb": 128
    }
  ],
  "graphs": [
    {
      "graph_names": ["pi05_action_expert"],
      "perf_profile": "burst"
    }
  ]
}
